{
  "fixture_id": "fa_gap_009",
  "eval_set_id": "gap_detection_eval_v1",
  "language": "fa",
  "project_type": "portfolio",
  "input": {
    "context_version": 1,
    "source_versions": [
      {
        "source_id": "fa_gap_009_src",
        "source_version_id": "fa_gap_009_src_v1",
        "canonical_length": 64
      }
    ],
    "context_items": [
      {
        "context_item_id": "fa_gap_009_ctx_1",
        "item_type": "fact",
        "content": "در یک بخش فرم تماس ضروری اعلام شده و در بخش دیگر فرم تماس حذف شده است.",
        "source_refs": [
          {
            "source_id": "fa_gap_009_src",
            "source_version_id": "fa_gap_009_src_v1",
            "start_offset": 0,
            "end_offset": 24
          }
        ],
        "status": "confirmed"
      }
    ],
    "requirements": [
      {
        "requirement_id": "fa_gap_009_req_a",
        "status": "confirmed",
        "priority": "must"
      },
      {
        "requirement_id": "fa_gap_009_req_b",
        "status": "draft",
        "priority": "must"
      }
    ]
  },
  "expected_output": {
    "no_gap": false,
    "gaps": [
      {
        "gold_gap_id": "fa_gap_009_gold_1",
        "gap_type": "conflict",
        "severity": "critical",
        "source_refs_expectation": "required",
        "source_refs": [
          {
            "source_id": "fa_gap_009_src",
            "source_version_id": "fa_gap_009_src_v1",
            "start_offset": 0,
            "end_offset": 24
          }
        ],
        "affected_requirement_ids": [
          "fa_gap_009_req_a",
          "fa_gap_009_req_b"
        ],
        "critical_for_scope": true,
        "critical_rule_id": "CGR-002",
        "semantic_group_id": "fa_gap_009_group_1"
      }
    ]
  },
  "evaluation_annotations": {
    "deterministic_output_candidate_ids": [
      "fa_gap_009_candidate_1"
    ],
    "candidate_annotations": [
      {
        "candidate_id": "fa_gap_009_candidate_1",
        "gold_gap_id": "fa_gap_009_gold_1",
        "semantically_unsupported": false,
        "critical_for_scope": true,
        "source_refs_expectation": "required"
      }
    ],
    "semantic_duplicate_groups": []
  },
  "metadata": {
    "synthetic": true,
    "segment": "unsupported",
    "difficulty": "hard",
    "phenomena": [
      "conflict",
      "critical"
    ],
    "fixture_version": "1"
  }
}
